{
  "schema_version": "v1",
  "request_id": "req-123",
  "model_results": [
    {
      "model": "multi-risk-v1",
      "label": "credential_theft",
      "confidence": 0.93
    }
  ],
  "categories": [
    {
      "category": "credential_theft",
      "severity": 78
    },
    {
      "category": "social_engineering",
      "severity": 44
    }
  ]
}
